,question_text,subject,topic,avg_score,correct_percentage,num_students_attempted,num_students_correct,time_taken_minutes,bloom_level,difficulty
1742,Discuss the challenges faced during the implementation of Diversity in Living Organisms in a developing country.,Biology,Diversity in Living Organisms,41.1,0.41,259.0,106.0,15.0,Evaluate,Hard
1755,Define the term Agriculture. Mention its SI unit.,Geography,Agriculture,75.9,0.76,460.0,349.0,4.0,Remember,Easy
1769,Design an experiment to demonstrate the properties of Cyber Safety.,Computer Science,Cyber Safety,30.1,0.3,165.0,49.0,15.0,Create,Hard
1774,State the law of Human Eye and Colourful World.,Physics,Human Eye and Colourful World,72.3,0.72,175.0,126.0,4.0,Remember,Easy
1783,Discuss the challenges faced during the implementation of Linear Equations in Two Variables in a developing country.,Mathematics,Linear Equations in Two Variables,35.3,0.35,272.0,96.0,10.0,Evaluate,Hard
1787,Suggest three measures to improve the efficiency of Heredity and Evolution.,Biology,Heredity and Evolution,16.4,0.16,508.0,83.0,14.0,Create,Hard
1795,Define the term Carbon and its Compounds. Mention its SI unit.,Chemistry,Carbon and its Compounds,81.9,0.82,363.0,297.0,2.0,Remember,Easy
1800,How does The Making of a Global World affect the overall outcome of the process? Explain.,History,The Making of a Global World,45.8,0.46,558.0,255.0,9.0,Analyze,Medium
1817,Explain the process of Boolean Algebra with the help of a labeled diagram.,Computer Science,Boolean Algebra,49.2,0.49,479.0,235.0,5.0,Apply,Medium
1828,Explain the process of Trigonometric Identities with the help of a labeled diagram.,Mathematics,Trigonometric Identities,67.5,0.68,216.0,145.0,9.0,Apply,Medium
1835,What is meant by Control and Coordination? Give one example.,Biology,Control and Coordination,76.1,0.76,510.0,388.0,2.0,Remember,Easy
1845,How does Periodic Classification of Elements affect the overall outcome of the process? Explain.,Chemistry,Periodic Classification of Elements,56.7,0.57,441.0,250.0,9.0,Analyze,Medium
1849,Mention the main components of The Making of a Global World.,History,The Making of a Global World,91.1,0.91,242.0,220.0,3.0,Remember,Easy
1860,Discuss the challenges faced during the implementation of Globalization and the Indian Economy in a developing country.,Economics,Globalization and the Indian Economy,41.8,0.42,552.0,230.0,15.0,Evaluate,Hard
1875,A student performs an experiment on Gravitation. What observations would they record?,Physics,Gravitation,63.3,0.63,259.0,164.0,6.0,Apply,Medium
1899,"In the context of The Age of Industrialisation, evaluate the statement: 'Prevention is better than cure.'",History,The Age of Industrialisation,36.0,0.36,348.0,125.0,17.0,Evaluate,Hard
1900,Why is Print Culture and the Modern World considered essential for the functioning of the system?,History,Print Culture and the Modern World,66.4,0.66,472.0,313.0,9.0,Analyze,Medium
1901,Discuss the challenges faced during the implementation of Resources and Development in a developing country.,Geography,Resources and Development,38.1,0.38,280.0,106.0,16.0,Evaluate,Hard
1923,Why is Work and Energy considered essential for the functioning of the system?,Physics,Work and Energy,51.6,0.52,588.0,303.0,5.0,Analyze,Medium
1933,Why is Control and Coordination considered essential for the functioning of the system?,Biology,Control and Coordination,57.0,0.57,180.0,102.0,9.0,Analyze,Medium
1942,What is meant by Carbon and its Compounds? Give one example.,Chemistry,Carbon and its Compounds,85.6,0.86,186.0,159.0,2.0,Remember,Easy
1945,Discuss the challenges faced during the implementation of The Rise of Nationalism in Europe in a developing country.,History,The Rise of Nationalism in Europe,30.0,0.3,189.0,56.0,12.0,Evaluate,Hard
1946,"In the context of Nationalism in India, evaluate the statement: 'Prevention is better than cure.'",History,Nationalism in India,16.1,0.16,291.0,46.0,16.0,Evaluate,Hard
1954,What is meant by Lifelines of National Economy? Give one example.,Geography,Lifelines of National Economy,71.3,0.71,404.0,287.0,3.0,Remember,Easy
1955,Design an experiment to demonstrate the properties of Development.,Economics,Development,23.6,0.24,157.0,37.0,11.0,Create,Hard
1956,How does Sectors of the Indian Economy affect the overall outcome of the process? Explain.,Economics,Sectors of the Indian Economy,64.8,0.65,387.0,250.0,8.0,Analyze,Medium
1980,Analyze the impact of Triangles and Circles on the Indian economy over the last decade.,Mathematics,Triangles and Circles,34.2,0.34,495.0,169.0,17.0,Evaluate,Hard
1983,"In the context of Heredity and Evolution, evaluate the statement: 'Prevention is better than cure.'",Biology,Heredity and Evolution,27.3,0.27,180.0,49.0,13.0,Evaluate,Hard
1985,How does Cell Structure and Functions affect the overall outcome of the process? Explain.,Biology,Cell Structure and Functions,65.4,0.65,597.0,390.0,6.0,Analyze,Medium
1991,Write any two characteristics of Carbon and its Compounds.,Chemistry,Carbon and its Compounds,89.6,0.9,198.0,177.0,2.0,Understand,Easy
2006,Discuss the challenges faced during the implementation of Money and Credit in a developing country.,Economics,Money and Credit,40.1,0.4,436.0,174.0,11.0,Evaluate,Hard
2013,State the law of Boolean Algebra.,Computer Science,Boolean Algebra,87.6,0.88,443.0,387.0,2.0,Remember,Easy
2020,Mention the main components of Motion and Laws of Motion.,Physics,Motion and Laws of Motion,74.7,0.75,319.0,238.0,3.0,Remember,Easy
2022,Design an experiment to demonstrate the properties of Gravitation.,Physics,Gravitation,41.0,0.41,343.0,140.0,19.0,Create,Hard
2036,Suggest three measures to improve the efficiency of Diversity in Living Organisms.,Biology,Diversity in Living Organisms,23.0,0.23,259.0,59.0,13.0,Create,Hard
2052,"Differentiate between Lifelines of National Economy and its alternative, giving three points of distinction.",Geography,Lifelines of National Economy,67.6,0.68,332.0,224.0,5.0,Analyze,Medium
2079,Why is Life Processes considered essential for the functioning of the system?,Biology,Life Processes,63.8,0.64,542.0,345.0,7.0,Analyze,Medium
2091,How is Structure of the Atom different from other concepts in this category?,Chemistry,Structure of the Atom,90.7,0.91,460.0,417.0,2.0,Understand,Easy
2093,How is Nationalism in India different from other concepts in this category?,History,Nationalism in India,79.8,0.8,238.0,189.0,3.0,Understand,Easy
2102,How is Development different from other concepts in this category?,Economics,Development,86.9,0.87,276.0,239.0,4.0,Understand,Easy
2107,"In the context of C++ Programming, evaluate the statement: 'Prevention is better than cure.'",Computer Science,C++ Programming,16.8,0.17,476.0,80.0,13.0,Evaluate,Hard
2118,What is meant by Motion and Laws of Motion? Give one example.,Physics,Motion and Laws of Motion,88.8,0.89,487.0,432.0,4.0,Remember,Easy
2129,How is Control and Coordination different from other concepts in this category?,Biology,Control and Coordination,70.9,0.71,365.0,258.0,2.0,Understand,Easy
2146,Define the term Resources and Development. Mention its SI unit.,Geography,Resources and Development,78.8,0.79,355.0,279.0,3.0,Remember,Easy
2165,How is Magnetic Effects of Current different from other concepts in this category?,Physics,Magnetic Effects of Current,91.5,0.91,282.0,257.0,3.0,Understand,Easy
2182,Calculate the value of Tissues given the standard parameters.,Biology,Tissues,51.9,0.52,395.0,205.0,6.0,Apply,Medium
2199,Mention the main components of Lifelines of National Economy.,Geography,Lifelines of National Economy,72.5,0.72,334.0,242.0,3.0,Remember,Easy
2220,State the law of Trigonometric Identities.,Mathematics,Trigonometric Identities,71.7,0.72,372.0,266.0,2.0,Remember,Easy
2221,Mention the main components of Coordinate Geometry.,Mathematics,Coordinate Geometry,80.8,0.81,392.0,316.0,3.0,Remember,Easy
2226,How is Life Processes different from other concepts in this category?,Biology,Life Processes,84.4,0.84,385.0,324.0,4.0,Understand,Easy
2232,"In the context of Diversity in Living Organisms, evaluate the statement: 'Prevention is better than cure.'",Biology,Diversity in Living Organisms,28.5,0.28,325.0,92.0,16.0,Evaluate,Hard
2236,Critically examine the role of Carbon and its Compounds in the current socio-political scenario.,Chemistry,Carbon and its Compounds,24.8,0.25,323.0,80.0,10.0,Evaluate,Hard
2243,Suggest three measures to improve the efficiency of Print Culture and the Modern World.,History,Print Culture and the Modern World,35.9,0.36,425.0,152.0,12.0,Create,Hard
2245,Critically examine the role of Agriculture in the current socio-political scenario.,Geography,Agriculture,20.1,0.2,550.0,110.0,13.0,Evaluate,Hard
2266,Explain the process of Work and Energy with the help of a labeled diagram.,Physics,Work and Energy,50.0,0.5,296.0,148.0,9.0,Apply,Medium
2270,Design an experiment to demonstrate the properties of Coordinate Geometry.,Mathematics,Coordinate Geometry,28.9,0.29,512.0,147.0,11.0,Create,Hard
2274,What is meant by Triangles and Circles? Give one example.,Mathematics,Triangles and Circles,77.8,0.78,443.0,344.0,2.0,Remember,Easy
2293,Design an experiment to demonstrate the properties of Resources and Development.,Geography,Resources and Development,32.2,0.32,432.0,139.0,17.0,Create,Hard
2296,Why is Manufacturing Industries considered essential for the functioning of the system?,Geography,Manufacturing Industries,56.1,0.56,231.0,129.0,7.0,Analyze,Medium
2300,What is meant by Money and Credit? Give one example.,Economics,Money and Credit,76.1,0.76,524.0,398.0,4.0,Remember,Easy
2311,Explain the process of Reflection and Refraction with the help of a labeled diagram.,Physics,Reflection and Refraction,50.2,0.5,356.0,178.0,6.0,Apply,Medium
2318,Critically examine the role of Trigonometric Identities in the current socio-political scenario.,Mathematics,Trigonometric Identities,22.7,0.23,329.0,74.0,15.0,Evaluate,Hard
2344,Critically examine the role of Minerals and Energy Resources in the current socio-political scenario.,Geography,Minerals and Energy Resources,40.4,0.4,247.0,99.0,16.0,Evaluate,Hard
2368,Explain the process of Coordinate Geometry with the help of a labeled diagram.,Mathematics,Coordinate Geometry,60.0,0.6,416.0,249.0,6.0,Apply,Medium
2372,Write any two characteristics of Triangles and Circles.,Mathematics,Triangles and Circles,81.2,0.81,361.0,293.0,4.0,Understand,Easy
2384,Explain the process of Periodic Classification of Elements with the help of a labeled diagram.,Chemistry,Periodic Classification of Elements,53.7,0.54,416.0,223.0,6.0,Apply,Medium
2416,Discuss the challenges faced during the implementation of Trigonometric Identities in a developing country.,Mathematics,Trigonometric Identities,19.5,0.2,415.0,81.0,13.0,Evaluate,Hard
2427,Analyze the impact of Tissues on the Indian economy over the last decade.,Biology,Tissues,34.1,0.34,301.0,102.0,16.0,Evaluate,Hard
2504,Define the term Cyber Safety. Mention its SI unit.,Computer Science,Cyber Safety,87.8,0.88,490.0,430.0,3.0,Remember,Easy
2526,"Differentiate between Diversity in Living Organisms and its alternative, giving three points of distinction.",Biology,Diversity in Living Organisms,64.3,0.64,386.0,248.0,9.0,Analyze,Medium
2530,Calculate the value of Carbon and its Compounds given the standard parameters.,Chemistry,Carbon and its Compounds,66.4,0.66,301.0,199.0,5.0,Apply,Medium
2538,Critically examine the role of Resources and Development in the current socio-political scenario.,Geography,Resources and Development,19.5,0.19,511.0,99.0,19.0,Evaluate,Hard
2541,Suggest three measures to improve the efficiency of Manufacturing Industries.,Geography,Manufacturing Industries,30.5,0.31,150.0,45.0,18.0,Create,Hard
2600,Suggest three measures to improve the efficiency of Computer Networks (OSI Model).,Computer Science,Computer Networks (OSI Model),27.1,0.27,415.0,112.0,17.0,Create,Hard
2607,"Differentiate between Human Eye and Colourful World and its alternative, giving three points of distinction.",Physics,Human Eye and Colourful World,53.2,0.53,413.0,219.0,9.0,Analyze,Medium
2609,"In the context of Work and Energy, evaluate the statement: 'Prevention is better than cure.'",Physics,Work and Energy,16.9,0.17,278.0,47.0,16.0,Evaluate,Hard
2611,Write any two characteristics of Arithmetic Progressions.,Mathematics,Arithmetic Progressions,91.5,0.92,300.0,274.0,4.0,Understand,Easy
2616,Why is Linear Equations in Two Variables considered essential for the functioning of the system?,Mathematics,Linear Equations in Two Variables,49.3,0.49,216.0,106.0,7.0,Analyze,Medium
2626,"How does Acids, Bases and Salts affect the overall outcome of the process? Explain.",Chemistry,"Acids, Bases and Salts",45.2,0.45,532.0,240.0,6.0,Analyze,Medium
2644,"In the context of Globalization and the Indian Economy, evaluate the statement: 'Prevention is better than cure.'",Economics,Globalization and the Indian Economy,29.6,0.3,543.0,160.0,11.0,Evaluate,Hard
2702,A student performs an experiment on Electric Current and Circuits. What observations would they record?,Physics,Electric Current and Circuits,54.5,0.55,351.0,191.0,6.0,Apply,Medium
2806,"In the context of Gravitation, evaluate the statement: 'Prevention is better than cure.'",Physics,Gravitation,16.6,0.17,276.0,45.0,19.0,Evaluate,Hard
2821,Suggest three measures to improve the efficiency of Chemical Reactions and Equations.,Chemistry,Chemical Reactions and Equations,34.9,0.35,430.0,149.0,11.0,Create,Hard
2840,Mention the main components of Globalization and the Indian Economy.,Economics,Globalization and the Indian Economy,74.3,0.74,443.0,329.0,4.0,Remember,Easy
2858,Calculate the value of Coordinate Geometry given the standard parameters.,Mathematics,Coordinate Geometry,67.9,0.68,463.0,314.0,8.0,Apply,Medium
2867,What is meant by Cell Structure and Functions? Give one example.,Biology,Cell Structure and Functions,72.1,0.72,514.0,370.0,4.0,Remember,Easy
2872,Critically examine the role of Metals and Non-metals in the current socio-political scenario.,Chemistry,Metals and Non-metals,34.5,0.35,313.0,107.0,14.0,Evaluate,Hard
2904,What is meant by Gravitation? Give one example.,Physics,Gravitation,88.0,0.88,429.0,377.0,4.0,Remember,Easy
2910,Calculate the value of Linear Equations in Two Variables given the standard parameters.,Mathematics,Linear Equations in Two Variables,55.6,0.56,440.0,244.0,6.0,Apply,Medium
2944,Critically examine the role of Boolean Algebra in the current socio-political scenario.,Computer Science,Boolean Algebra,21.7,0.22,346.0,75.0,13.0,Evaluate,Hard
2948,Critically examine the role of Reflection and Refraction in the current socio-political scenario.,Physics,Reflection and Refraction,43.8,0.44,355.0,155.0,11.0,Evaluate,Hard
2960,Critically examine the role of Triangles and Circles in the current socio-political scenario.,Mathematics,Triangles and Circles,28.1,0.28,322.0,90.0,14.0,Evaluate,Hard
2964,"Differentiate between Our Environment and its alternative, giving three points of distinction.",Biology,Our Environment,59.4,0.59,364.0,216.0,8.0,Analyze,Medium
2989,Design an experiment to demonstrate the properties of C++ Programming.,Computer Science,C++ Programming,33.1,0.33,152.0,50.0,17.0,Create,Hard
3078,"In the context of Agriculture, evaluate the statement: 'Prevention is better than cure.'",Geography,Agriculture,15.4,0.15,513.0,79.0,19.0,Evaluate,Hard
3080,Analyze the impact of Manufacturing Industries on the Indian economy over the last decade.,Geography,Manufacturing Industries,19.9,0.2,325.0,64.0,13.0,Evaluate,Hard
3089,Analyze the impact of Python Lists and Tuples on the Indian economy over the last decade.,Computer Science,Python Lists and Tuples,43.5,0.43,397.0,172.0,10.0,Evaluate,Hard
3093,Discuss the challenges faced during the implementation of HTML/CSS Structure in a developing country.,Computer Science,HTML/CSS Structure,41.4,0.41,273.0,112.0,11.0,Evaluate,Hard
3111,"In the context of Our Environment, evaluate the statement: 'Prevention is better than cure.'",Biology,Our Environment,42.5,0.42,262.0,111.0,16.0,Evaluate,Hard
3114,Design an experiment to demonstrate the properties of Diversity in Living Organisms.,Biology,Diversity in Living Organisms,16.9,0.17,404.0,68.0,14.0,Create,Hard
3139,"In the context of Computer Networks (OSI Model), evaluate the statement: 'Prevention is better than cure.'",Computer Science,Computer Networks (OSI Model),30.3,0.3,504.0,152.0,10.0,Evaluate,Hard
3219,Explain the process of The Rise of Nationalism in Europe with the help of a labeled diagram.,History,The Rise of Nationalism in Europe,58.6,0.59,538.0,315.0,8.0,Apply,Medium
3245,How is Motion and Laws of Motion different from other concepts in this category?,Physics,Motion and Laws of Motion,83.0,0.83,176.0,146.0,4.0,Understand,Easy
3264,"Differentiate between Metals and Non-metals and its alternative, giving three points of distinction.",Chemistry,Metals and Non-metals,55.1,0.55,482.0,265.0,7.0,Analyze,Medium
3291,"In the context of Reflection and Refraction, evaluate the statement: 'Prevention is better than cure.'",Physics,Reflection and Refraction,39.8,0.4,543.0,215.0,10.0,Evaluate,Hard
3399,Calculate the value of Probability given the standard parameters.,Mathematics,Probability,61.4,0.61,564.0,346.0,7.0,Apply,Medium
3409,Why is Chemical Reactions and Equations considered essential for the functioning of the system?,Chemistry,Chemical Reactions and Equations,62.8,0.63,252.0,158.0,7.0,Analyze,Medium
3441,Design an experiment to demonstrate the properties of Motion and Laws of Motion.,Physics,Motion and Laws of Motion,31.8,0.32,472.0,149.0,17.0,Create,Hard
3478,Critically examine the role of Consumer Rights in the current socio-political scenario.,Economics,Consumer Rights,44.6,0.45,185.0,82.0,11.0,Evaluate,Hard
3577,Mention the main components of C++ Programming.,Computer Science,C++ Programming,74.6,0.75,453.0,337.0,2.0,Remember,Easy
3603,How does Tissues affect the overall outcome of the process? Explain.,Biology,Tissues,55.4,0.55,446.0,247.0,7.0,Analyze,Medium
3609,State the law of Periodic Classification of Elements.,Chemistry,Periodic Classification of Elements,82.3,0.82,344.0,283.0,4.0,Remember,Easy
3625,What is meant by Consumer Rights? Give one example.,Economics,Consumer Rights,89.7,0.9,222.0,199.0,4.0,Remember,Easy
3827,State the law of Cyber Safety.,Computer Science,Cyber Safety,84.3,0.84,421.0,354.0,2.0,Remember,Easy
4037,What is meant by Linear Equations in Two Variables? Give one example.,Mathematics,Linear Equations in Two Variables,77.0,0.77,216.0,166.0,3.0,Remember,Easy
4286,Design an experiment to demonstrate the properties of Heredity and Evolution.,Biology,Heredity and Evolution,44.9,0.45,558.0,250.0,10.0,Create,Hard
4406,Write any two characteristics of Sectors of the Indian Economy.,Economics,Sectors of the Indian Economy,75.4,0.75,570.0,429.0,3.0,Understand,Easy
4512,"Differentiate between Boolean Algebra and its alternative, giving three points of distinction.",Computer Science,Boolean Algebra,50.2,0.5,576.0,289.0,5.0,Analyze,Medium
4618,Design an experiment to demonstrate the properties of Work and Energy.,Physics,Work and Energy,22.6,0.23,549.0,124.0,18.0,Create,Hard
4668,Write any two characteristics of Gravitation.,Physics,Gravitation,79.2,0.79,577.0,456.0,3.0,Understand,Easy
0,Solve the following problem step by step and justify each step clearly: Number Systems.,Maths,Number Systems,0.749,,2316.0,1760.0,,Remember,Easy
1,Solve the following problem step by step and justify each step clearly: Statistics.,Maths,Statistics,0.823,84.18,2032.0,1711.0,3.0,Remember,Easy
2,State the laws or principles related to Biology - Ecology and derive the necessary expressions.,Science,Biology - Ecology,0.968,90.63,334.0,303.0,1.0,Remember,Easy
3,"Using appropriate mathematical reasoning, explain the concept of Calculus and solve a related example.",Maths,Calculus,0.726,76.34,840.0,641.0,3.0,Remember,Easy
4,Explain the major features of History and analyse its impact.,Social Science,History,0.646,79.94,1341.0,1072.0,2.0,Remember,Easy
5,Explain the working of Networks with a suitable algorithm.,Computer Science,Networks,,16.94,1000.0,169.0,15.0,Apply,Hard
6,Explain the concept of Macroeconomics with the help of a diagram.,Economics,Macroeconomics,0.503,49.74,1133.0,564.0,5.0,Analyze,Moderate
7,Differentiate between related concepts in Biology - Ecology with suitable examples.,Science,Biology - Ecology,0.474,46.56,2100.0,978.0,4.0,Understand,Moderate
8,Write a program to demonstrate Data Structures and explain the logic used.,Computer Science,Data Structures,0.702,75.01,754.0,566.0,2.0,Apply,Easy
9,Write a program to demonstrate Databases and explain the logic used.,Computer Science,Databases,0.82,67.19,1446.0,972.0,2.0,Remember,Easy
10,Solve the following problem step by step and justify each step clearly: Geometry.,Maths,Geometry,0.701,63.54,1610.0,1023.0,2.0,Understand,Easy
12,Explain the theme and literary devices used in the lesson related to Literature.,English,Literature,0.357,29.77,586.0,174.0,14.0,Analyze,Hard
13,Explain the concept of Microeconomics with the help of a diagram.,Economics,Microeconomics,0.246,26.96,530.0,143.0,9.0,Analyze,Hard
14,Design a simple application that implements Digital Logic.,Computer Science,Digital Logic,0.353,49.44,1290.0,638.0,7.0,Understand,Moderate
15,"Using appropriate mathematical reasoning, explain the concept of Number Systems and solve a related example.",Maths,Number Systems,0.635,68.92,158.0,109.0,2.0,Remember,Easy
16,Examine the causes and consequences associated with Civics.,Social Science,Civics,0.937,86.25,2394.0,2065.0,3.0,Remember,Easy
17,A student is required to apply the concept of Statistics. Formulate and solve a suitable problem.,Maths,Statistics,0.722,69.53,2452.0,1705.0,4.0,Remember,Easy
19,Identify and correct the errors related to Grammar in the given sentences.,English,Grammar,0.354,27.35,1617.0,442.0,16.0,Evaluate,Hard
20,Differentiate between key concepts in Databases with examples.,Computer Science,Databases,0.424,39.55,931.0,368.0,10.0,Understand,Moderate
22,Explain the working of Digital Logic with a suitable algorithm.,Computer Science,Digital Logic,0.069,22.83,1189.0,271.0,11.0,Evaluate,Hard
23,Differentiate between key concepts in Networks with examples.,Computer Science,Networks,0.867,74.86,739.0,553.0,2.0,Understand,Easy
24,Write a program to demonstrate Programming and explain the logic used.,Computer Science,Programming,0.615,65.53,1309.0,858.0,3.0,Apply,Easy
25,Discuss the causes and effects associated with Microeconomics.,Economics,Microeconomics,0.607,52.97,991.0,525.0,5.0,Understand,Moderate
27,A student is required to apply the concept of Coordinate Geometry. Formulate and solve a suitable problem.,Maths,Coordinate Geometry,0.51,48.96,763.0,374.0,5.0,Understand,Moderate
28,Differentiate between related economic concepts in Statistics.,Economics,Statistics,0.648,76.12,2306.0,1755.0,3.0,Remember,Easy
30,Discuss the significance of Political Science in the context of Indian society and economy.,Social Science,Political Science,0.783,77.79,1068.0,831.0,4.0,Remember,Easy
31,Examine the causes and consequences associated with Economics.,Social Science,Economics,0.287,26.27,1672.0,439.0,14.0,Apply,Hard
32,Solve the following problem step by step and justify each step clearly: Algebra.,Maths,Algebra,0.718,62.65,940.0,589.0,4.0,Apply,Easy
33,Write a short note on Political Science highlighting key points.,Social Science,Political Science,0.526,59.91,2452.0,1469.0,10.0,Apply,Moderate
34,A student is required to apply the concept of Number Systems. Formulate and solve a suitable problem.,Maths,Number Systems,0.367,31.98,1075.0,344.0,9.0,Analyze,Moderate
37,Explain the concept of Indian Economy with the help of a diagram.,Economics,Indian Economy,0.222,18.44,1336.0,,9.0,Analyze,Hard
39,Differentiate between related economic concepts in Indian Economy.,Economics,Indian Economy,0.747,84.51,1546.0,1306.0,3.0,Remember,Easy
41,Analyse the importance of Statistics in the Indian economy.,Economics,Statistics,0.366,30.34,1132.0,343.0,8.0,Apply,Hard
43,Discuss the causes and effects associated with Macroeconomics.,Economics,Macroeconomics,0.33,30.25,479.0,145.0,12.0,Analyze,Hard
44,State the laws or principles related to Physics - Optics and derive the necessary expressions.,Science,Physics - Optics,0.324,30.09,1256.0,378.0,,Evaluate,Hard
45,Differentiate between related concepts in Chemistry - Inorganic with suitable examples.,Science,Chemistry - Inorganic,0.967,92.93,409.0,380.0,1.0,Understand,Easy
46,Write a well-structured paragraph discussing Writing Skills with suitable examples.,English,Writing Skills,0.261,33.91,1343.0,455.0,14.0,Apply,Hard
47,Differentiate between key concepts in Data Structures with examples.,Computer Science,Data Structures,0.138,19.79,1676.0,332.0,11.0,Create,Hard
48,Analyse the importance of Microeconomics in the Indian economy.,Economics,Microeconomics,0.709,71.47,634.0,453.0,3.0,Understand,Easy
49,Write a short note on Civics highlighting key points.,Social Science,Civics,0.614,54.77,2332.0,,6.0,Apply,Moderate
50,Analyse the importance of Macroeconomics in the Indian economy.,Economics,Macroeconomics,0.55,56.82,1486.0,844.0,7.0,Apply,Moderate
52,Identify and correct the errors related to Reading Comprehension in the given sentences.,English,Reading Comprehension,0.623,,1013.0,667.0,3.0,Remember,Easy
57,Explain the concept of Biology - Ecology with the help of a neat diagram wherever necessary.,Science,Biology - Ecology,0.081,15.6,1367.0,213.0,14.0,Evaluate,Hard
58,Discuss the significance of Civics in the context of Indian society and economy.,Social Science,Civics,0.917,82.57,1023.0,845.0,3.0,Understand,Easy
59,Write a well-structured paragraph discussing Literature with suitable examples.,English,Literature,0.807,83.21,480.0,399.0,3.0,Remember,Easy
